source,date,username,content,url,engagement,sentiment,category1,category2,category3
reddit,2025-10-13T10:49:54,amith-c,I read somewhere that you can use the Ather Grid chargers for free if factory mode is still active on your scooter... Maybe take advantage while it lasts lol,https://reddit.com/r/ATHERENERGY/comments/1o5fjce/factory_mode_not_gone/nj92i6y/,8,,,,
reddit,2025-10-13T12:25:42,dogizzgod,"Been through the situation very recently... Once my registration got done they activated the pro pack and removed the factory mode( 20 days post purchase) . Although its very bad practice to do it this way, looks like that is the protocol that the Ather follows. Cant do much about it as a customer I guess. I know it is not easy but the best you can do is.. Post it on twitter, keep following up and wait until the registration is done.",https://reddit.com/r/ATHERENERGY/comments/1o5fjce/factory_mode_not_gone/nj9f02x/,3,,,,
reddit,2025-10-13T13:57:45,Hare_97,"They do it because it's like a free look window for you. Once the registration is complete, there is no backing up from the deal. 

So as soon as the RC is generated, your Factory Mode will be removed. In my case, it got removed right after an free ather grid charge 😭 (though it indeed took over 1-2 weeks for the mode to be removed)",https://reddit.com/r/ATHERENERGY/comments/1o5fjce/factory_mode_not_gone/nj9udig/,1,,,,
reddit,2025-10-13T09:50:20,Sakshamagarwal2702,"Nice choice. 

How many kms you have convered on your Rizta Z?",https://reddit.com/r/ATHERENERGY/comments/1o5cwx0/the_ability_to_turn_of_brake_regen_and_use_magic/nj8w7zb/,1,,,,
reddit,2025-10-13T10:36:39,Sakshamagarwal2702,"Yes all the Best!

No tension Ather is good!",https://reddit.com/r/ATHERENERGY/comments/1o5cwx0/the_ability_to_turn_of_brake_regen_and_use_magic/nj910oy/,1,,,,
reddit,2025-10-13T00:50:09,hiten-desai,"EVs are always overpriced, but you can go with Ather. They have more standard compared to Ola, Tvs. The parts quality is also good and you will get a good experience in terms of service as well.",https://reddit.com/r/ATHERENERGY/comments/1o5249x/buying_ather_rizta_s_with_37_kwh/nj731lf/,1,,,,
reddit,2025-10-13T02:05:59,Proof-Storage-4067,Thanks brother....    This is the main reason I am ather ....  Rather than other ev,https://reddit.com/r/ATHERENERGY/comments/1o5249x/buying_ather_rizta_s_with_37_kwh/nj7f862/,1,,,,
reddit,2025-10-12T16:48:04,Prophet9192,Main stand isn’t sold as an original Ather accessory.,https://reddit.com/r/ATHERENERGY/comments/1o4tsou/my_6_month_experience_with_ather_rizta_z_29kwh/nj4mcmc/,3,,,,
reddit,2025-10-13T09:43:01,mommyindian,"Ather is very reliable and a great scooter because it is always compared with Ola. And yes it is better than Ola but still it is a substandard product. Ather was considered reliable and better choice only until they were selling barely few scooters but with increase in their sales their issues are being highlighted. And their sales number only increased because of Ola's downfall.

Hero Motocorp hold majority stake in Ather, a company which is known for it's substandard products and bad after sales service. Hero is still in market because of nostalgia, cheap products suitable for poor people, nationalism and manipulating consumer perspective..

Ather is just doing unethical marketing gimmicks. Youtubers are paid, social media PR, bots flooding the forums and communities. 

  
tldr: the scooters are substandard. company is not ethical. there is no real innovation from Ather.",https://reddit.com/r/ATHERENERGY/comments/1o4tsou/my_6_month_experience_with_ather_rizta_z_29kwh/nj8vhdr/,3,,,,
reddit,2025-10-13T14:52:18,TurboBeast_,"Random software update- That too early morning when you are already late to start the day!

My Ather sometimes feels little hard / rough while taking turns or driving only straight. What could be the issue? Is it something to do with auto hold? 
It just feels rough and I can’t describe the issue!",https://reddit.com/r/ATHERENERGY/comments/1o4tsou/my_6_month_experience_with_ather_rizta_z_29kwh/nja4vzk/,2,,,,
reddit,2025-10-14T08:54:11,omgimsuchabitch,key lock mechanism is very weak and needs to be upgraded cuz the poor quality of it increases chances of it getting stollen and one key point is that we also had the SAME PROBLEM in our ather too cuz we had to change the lock after 6 months of buying of the vehicle and my dad was pretty bummed by the fact cuz he was 3kms away from the service centre and he had noone to help him.,https://reddit.com/r/ATHERENERGY/comments/1o4tsou/my_6_month_experience_with_ather_rizta_z_29kwh/njf1v9q/,2,,,,
reddit,2025-10-14T08:55:07,omgimsuchabitch,they only claim that they can fit 2 ather helmets only. you can see it in their ads too.,https://reddit.com/r/ATHERENERGY/comments/1o4tsou/my_6_month_experience_with_ather_rizta_z_29kwh/njf1yc9/,2,,,,
reddit,2025-10-14T08:57:47,omgimsuchabitch,totally agree with the pillion problems cuz it hard for old aunties and uncle's to get off the ather.,https://reddit.com/r/ATHERENERGY/comments/1o4tsou/my_6_month_experience_with_ather_rizta_z_29kwh/njf27nb/,2,,,,
reddit,2025-10-12T18:38:55,Jumpy-Ab,Bhai mre Ather m jese he speed 25-30 tak rehte na to andhr se ajeeb awaj atee mtlb jse kch rotate hora ho uneven service wale bolte saab m ata apke isme bhi ata ky ye?,https://reddit.com/r/ATHERENERGY/comments/1o4tsou/my_6_month_experience_with_ather_rizta_z_29kwh/nj58oci/,1,,,,
reddit,2025-10-13T18:14:22,johnnybravo9315,"I was confused between iQube and Rizta, skipped Rizta only because of two reasons: the belt noise. It's so noisy when it's new. I wonder how it will sound after two years. And the body shape is weird, especially from the back.

Finally booked iQube, now waiting for delivery.",https://reddit.com/r/ATHERENERGY/comments/1o4tsou/my_6_month_experience_with_ather_rizta_z_29kwh/njbauf1/,1,,,,
reddit,2025-10-14T08:45:41,omgimsuchabitch,"the front panel sound can be fixed cuz the whole panel is just connected with some locks (6 locks as told by technicians) usually whenever i go to get my rizta serviced i tell them to change the panel, you can tell them that too just keep in mind that this is a faulty defect from the company so dont let them charge you for it if you have the warranty of the rizta",https://reddit.com/r/ATHERENERGY/comments/1o4tsou/my_6_month_experience_with_ather_rizta_z_29kwh/njf120w/,1,,,,
reddit,2025-10-14T08:50:23,omgimsuchabitch,"the random update thingy problem i have never gotten neither my dad and our workers (our workers drive our rizta as it is eco-friendly and convenient) but my dad told me ""whenever the scooter gets the update it only updates unless you start the update on your own or during their automated time (2 am to 4 am) you wouldnt have got the problem until and unless you were driving between 2 am and 4 am.",https://reddit.com/r/ATHERENERGY/comments/1o4tsou/my_6_month_experience_with_ather_rizta_z_29kwh/njf1i54/,1,,,,
reddit,2025-10-13T15:56:10,fomosapien02,"That pretty much explains why the Ather fast charging points are more engaged by Vida users charging (100% for free?) While we're able to charge only up until 80%. 

Also I guess it is safe to say Ather is somewhat overpriced at the same time it feels like it doesn't put much thought in to customer's perspectives or needs. 

The thing with the headlights and them not even providing a simpler USB port for charging the phone or even not providing a much needed dark mode to the Rizta cluster screen... Pretty much sums it up",https://reddit.com/r/ATHERENERGY/comments/1o4tsou/my_6_month_experience_with_ather_rizta_z_29kwh/njahtki/,1,,,,
reddit,2025-10-12T17:37:28,Prophet9192,"No problem. The battery is the most important and expensive part of an electric scooter, I strongly discourage anyone on this thread from installing non-Ather accessories, atleast until your warranty runs out.",https://reddit.com/r/ATHERENERGY/comments/1o4tsou/my_6_month_experience_with_ather_rizta_z_29kwh/nj4wa8x/,2,,,,
reddit,2025-10-12T18:58:08,Big_Organization_978,"1. impossible 
2. strange, try recording it next time and send it to ather cc
3. same as 2",https://reddit.com/r/ATHERENERGY/comments/1o4tsou/my_6_month_experience_with_ather_rizta_z_29kwh/nj5cffz/,1,,,,
reddit,2025-10-12T18:34:22,Impressive_Sun5601,I buyed in August but no update on my rizta s 3.7kwh,https://reddit.com/r/ATHERENERGY/comments/1o4sbod/wtf_ather/nj57soo/,1,,,,
reddit,2025-10-13T10:11:17,Devansh_19409,My rizta 3.7 is giving 105 on zip,https://reddit.com/r/ATHERENERGY/comments/1o4ry9t/is_this_the_best_range_i_can_get/nj8yd4u/,1,,,,
reddit,2025-10-12T13:52:22,TomorrowAdvanced2749,"How is this related to Ather?  
This is more related to Credit Cards, not Ather.

  
Also, there is no limit to the cashback on Amazon ICICI CC.

I don't think there is anything you should worry about. Just make sure to not give in to the showroom people if they pester about cancelling this order & ask you to buy from them directly.",https://reddit.com/r/ATHERENERGY/comments/1o4pjlg/booking_the_scooter_on_amazonflipkart_as_it_has/nj3p6mu/,4,,,,
reddit,2025-10-12T16:10:20,tarunsamnth13," I purchased the Ather Rizta Z 159 variant (without Pro Pack) on Amazon on 22 September 2025, with a discount of ₹14,500 using a debit card.However, later I purchased a Pro Pack and am still waiting for it to be activated. The dealer said it will be activated after vehicle registration.

NOTE: I read somewhere on Reddit that if you purchase online, you won't get any additional accessories such as backrest, charger, helmet, mirror, etc. You also cannot opt for free charging at Ather Grid stations upon purchase. However, I got all the accessories except the free charging at Ather Grid stations.

However, this varies from dealer to dealer",https://reddit.com/r/ATHERENERGY/comments/1o4pjlg/booking_the_scooter_on_amazonflipkart_as_it_has/nj4euvk/,1,,,,
reddit,2025-10-12T04:00:49,naveenvaratharaj,i own a rizta z….i too feel brakes are slow and mid but magic twist helps a lot and way better,https://reddit.com/r/ATHERENERGY/comments/1o4erlz/brakes_feel_really_bad_on_my_new_ather_rizta_z/nj1v2m0/,6,,,,
reddit,2025-10-12T03:47:09,Buddha_apple,"Mine is Rizta s, yes the breaks are relatively slower compared to regular ICEs, I have a petrol vehicle (pulsar) which has both front and back disk breaks. However, since Rizta is a family scooter, showroom guys said rista back breaks are regular drum breaks and the vehicle was designed keeping old folks and ladies driving in mind, so breaks may not perform like 450 series.",https://reddit.com/r/ATHERENERGY/comments/1o4erlz/brakes_feel_really_bad_on_my_new_ather_rizta_z/nj1tb3h/,1,,,,
reddit,2025-10-12T04:15:15,lxcky04,I have an access 125 it has drum brakes in the front and back and it brakes better than Rizta. I feel Rizta is really poor.,https://reddit.com/r/ATHERENERGY/comments/1o4erlz/brakes_feel_really_bad_on_my_new_ather_rizta_z/nj1ww7c/,2,,,,
reddit,2025-10-12T13:56:37,omgimsuchabitch,i was not going downhill for 4.8 kms🙏. my dad drove the rizta from our shop to our home and no he doesnt drives slow his avg is 60-70.,https://reddit.com/r/ATHERENERGY/comments/1o3tdxl/w_rizta/nj3pw2u/,1,,,,
reddit,2025-10-11T09:15:58,OutrageousMud1740,"Ather will save u money, since your traveling 30km per day.

For instance any petrol scooter u will be paying 100 per day for petrol.

Ather might be costly but, there will be no issue.",https://reddit.com/r/ATHERENERGY/comments/1o3qxlq/should_i_consider_ather_over_a_petrol_scooter/niwxash/,5,,,,
reddit,2025-10-11T09:31:09,1PerpetuallyAnxious,"Take test drives for 450x and Rizta, both. I don't know where you're based, but I assume your city also has pothole filled roads, make sure to test drive on the worst roads for a good 15-20 mins. This will give you an idea of comfort. Rizta might give you better comfort for a 30 km ride in heavy traffic, but this is purely up to your personal preference.

I have to do 4 trips of 10 km each everyday through little to no traffic and went with Ather 450x 3.9kW. The fuel expense was burning a hole in my pocket and it was heartbreaking to see my 3rd most largest expense after rent and food was fuel.

I've barely spent 40 Rs. in charging cost and already travelled 250+ km on the Ather. Check out your local EV charging points whether Ather grid or other plug and pay outlets. Get an idea if they're working, being maintained, and if you have plenty of options around. Same for your college locality. Always plan ahead as a worst case scenario backup. If you feel you're covered on the charging points front, you can explore the EV option.

I absolutely love the ride on the Ather and have no regrets over this model. It's so light that my sister and my SO both enjoy it and say it's easy to handle. My sister is now planning to get the same model for herself.

Regardless of what you go with, safe travels and enjoy!",https://reddit.com/r/ATHERENERGY/comments/1o3qxlq/should_i_consider_ather_over_a_petrol_scooter/niwynpf/,1,,,,
reddit,2025-10-11T10:14:59,Sakshamagarwal2702,Go for Ather Rizta base varient..,https://reddit.com/r/ATHERENERGY/comments/1o3qxlq/should_i_consider_ather_over_a_petrol_scooter/nix2pvy/,1,,,,
reddit,2025-10-11T10:29:54,No_Flight_7684,Ather. It will be a great fun to drive.,https://reddit.com/r/ATHERENERGY/comments/1o3qxlq/should_i_consider_ather_over_a_petrol_scooter/nix45wd/,1,,,,
reddit,2025-10-11T13:17:39,Swimming-Marketing-5,"If your concern is spending close to 2L for a ather then just don't...
get a 450s for like 1.4l with pro pack, same range less expensive, less useless features 👍🏻",https://reddit.com/r/ATHERENERGY/comments/1o3qxlq/should_i_consider_ather_over_a_petrol_scooter/nixp5a6/,1,,,,
reddit,2025-10-11T14:45:53,chaddi-buddy,Take ather if your commute is daily 20km atleast.,https://reddit.com/r/ATHERENERGY/comments/1o3qxlq/should_i_consider_ather_over_a_petrol_scooter/niy3sn6/,1,,,,
reddit,2025-10-12T06:57:05,StrictlyNotion,"Electric in scooter makes more sense than cars. But my choice in electric scooters is TVS iQube then Chetak. IQube feels the most refined. Chetak feels the most premium. 

I have driven the Rizta- didnt like it. Also they are silent due to hub motors whereas Ather is belt driven. Both has pros n cons but I prefer hub motor over belt driven.",https://reddit.com/r/ATHERENERGY/comments/1o3qxlq/should_i_consider_ather_over_a_petrol_scooter/nj2ee5f/,1,,,,
reddit,2025-10-11T17:02:37,Hare_97,"I have forgotten by now but they are usually discussed in the Ather community forum. The only way now could be to search for the ""oldest"" service centres as all new SCs open under the dealer-license model",https://reddit.com/r/ATHERENERGY/comments/1o3qxlq/should_i_consider_ather_over_a_petrol_scooter/niytk52/,1,,,,
reddit,2025-10-12T07:40:39,Specific_Roll2681,Even i have an ather but range is very less. I would have to charge it almost every alternate days. Im also considering alternate options.,https://reddit.com/r/ATHERENERGY/comments/1o3qxlq/should_i_consider_ather_over_a_petrol_scooter/nj2inft/,2,,,,
reddit,2025-10-13T03:40:25,Specific_Roll2681,I have 2024 ather . I only get 90km in ride mode.,https://reddit.com/r/ATHERENERGY/comments/1o3qxlq/should_i_consider_ather_over_a_petrol_scooter/nj7tfk2/,1,,,,
reddit,2025-10-11T19:03:07,believeingod333,"Yeah, I think Apple's having Bluetooth problems with Ather.",https://reddit.com/r/ATHERENERGY/comments/1o3uqmd/bluetooth_issue_with_ios/nizgfrl/,1,,,,
reddit,2025-10-12T10:10:59,Flaky-Photo-2919,Rizta S has the same issue.,https://reddit.com/r/ATHERENERGY/comments/1o3uqor/bluetooth_issue_with_ios/nj2wyvp/,1,,,,
reddit,2025-10-10T16:21:46,TomorrowAdvanced2749,Follow the Ather one. 30F & 32R,https://reddit.com/r/ATHERENERGY/comments/1o35bul/what_tyre_pressure_do_u_all_have_in_your_ather/nisodto/,8,,,,
reddit,2025-10-11T04:42:30,Calm-Dirt9546,"I checked and it seems every ICE scooter has a 24 psi front and 28 psi rear recommended tyre pressure. Example -
Jupiter 2018 has a weight of 108 kg similar to ather but due to range I think ather says 30 F 28R for solo",https://reddit.com/r/ATHERENERGY/comments/1o35bul/what_tyre_pressure_do_u_all_have_in_your_ather/niw5o14/,1,,,,
reddit,2025-10-12T04:58:01,PuzzleheadedCellist6,I don't think even ather will recommend that,https://reddit.com/r/ATHERENERGY/comments/1o35bul/what_tyre_pressure_do_u_all_have_in_your_ather/nj220vd/,1,,,,
reddit,2025-10-10T16:57:56,NSA__14,"Lol
I get your point.
It's basically the contact patch between the vehicle and the road.
If the tire pressure is higher then contact patch is lower - leading to higher mileage. Not much but noticeable.

Check keynote at the ather day, ceo kinda says this.
Also the introduction of air pressure systems at the new fast chargers is a pointer.",https://reddit.com/r/ATHERENERGY/comments/1o35bul/what_tyre_pressure_do_u_all_have_in_your_ather/nisvpiq/,2,,,,
reddit,2025-10-10T17:31:36,mommyindian,Lol Ather fanboys are defending company's cheating. Peak manipulation,https://reddit.com/r/ATHERENERGY/comments/1o2uyk1/delivery_of_ather_rizta_s_with_an_old_battery/nit2pkz/,2,,,,
reddit,2025-10-10T17:50:42,shyampsunder,Was this Ather?,https://reddit.com/r/ATHERENERGY/comments/1o2uyk1/delivery_of_ather_rizta_s_with_an_old_battery/nit6pgp/,1,,,,
reddit,2025-10-10T18:38:14,beinghonest1998,"Whether it's something big or small, an issue with ather is a big issue to be tensed about. I faced the same issue and it came out to be a throttle sensor issue. Now I sold my ather and shifted to a petrol scooter. Atleast it's reliable.",https://reddit.com/r/ATHERENERGY/comments/1o32yqm/what_does_it_mean_anyone_faced_this_issue/nitg4rm/,1,,,,
reddit,2025-10-11T03:51:46,khateeek,I know bro but if Ather could make a product that could actually deliver like this that would be so awesome. If it's a bike I'm definitely getting it,https://reddit.com/r/ATHERENERGY/comments/1o2r9un/is_this_the_best_ather_can_do/nivz23s/,1,,,,
reddit,2025-10-10T10:25:07,beinghonest1998,Kindly stick to petrol for now. I bought an Ather 450x for 1.75 lacs on 2023 and sold it for around 75k on 2025. And I have shifted to petrol scooters again.  Atleast it's reliable and the headache of service center is less as compared to Ather.,https://reddit.com/r/ATHERENERGY/comments/1o2tius/need_help_choosing_between_ather_iqube_chetak_ola/niqz9uk/,1,,,,
reddit,2025-10-12T05:24:35,Kiranjisac,"I own an Ather Rizta Z. If u are looking for reliability and economic sense for ur usecase. Would recommend getting a really good petrol scooter.


Ather is gud, but definitely not worth what it costs and it's  maintenance and parts costs, please forget it 🤦",https://reddit.com/r/ATHERENERGY/comments/1o2tius/need_help_choosing_between_ather_iqube_chetak_ola/nj24yti/,1,,,,
reddit,2025-10-10T06:54:17,NoVariation9362,"Please dont buy any ev , they are a scam cost is too high for the quality they provide including ather . Please buy off an activa more the helpful",https://reddit.com/r/ATHERENERGY/comments/1o2tius/need_help_choosing_between_ather_iqube_chetak_ola/niqefx3/,-3,,,,
reddit,2025-10-10T19:58:05,-_-Gon,"Yeah, true that — for low usage, EVs don’t really give much financial benefit right now. My main reason for leaning towards an EV is actually the whole E20 rollout. With the govt increasing the ethanol blend, I’m a bit worried about long-term engine health and mileage drops on petrol vehicles. EVs just feel like a safer bet for the future, even if I don’t ride much.

I was actually looking at the Ather Rizta Z (123 km variant), but since you mentioned ICE makes more sense for low usage, could you suggest some good petrol scooters or bikes? I honestly don’t have much knowledge about vehicles.",https://reddit.com/r/ATHERENERGY/comments/1o2tius/need_help_choosing_between_ather_iqube_chetak_ola/nitvj63/,1,,,,
reddit,2025-10-11T14:19:30,Prudent_Situation633,"What bad experience did u have with Ather, that you had to sale",https://reddit.com/r/ATHERENERGY/comments/1o2tius/need_help_choosing_between_ather_iqube_chetak_ola/nixz2np/,1,,,,
reddit,2025-10-10T09:15:05,Hare_97,"While EV is not itself a scam, none of these companies have a good service centre reputation (Ather is too costly for the news to get out properly). I would suggest you to buy ICE for the peace of mind. I ""own"" a 450x but the service part was horrible. They are very polite but don't accept their wrong doings or manufacturing problems.",https://reddit.com/r/ATHERENERGY/comments/1o2tius/need_help_choosing_between_ather_iqube_chetak_ola/niqs4vc/,2,,,,
reddit,2025-10-14T05:43:16,NoVariation9362,"Bro i have a rizta top model, the indicator’s turn on randomly , when i actually want to use them they don’t, halo stopped working it took me 2 weeks of constantly calling them to get a replacement approved and i have still not received a confirmation for it , now i am unable to login to my ather app from past 3 days , the customer support only knows to say that they have escalated the matter to the relevant teams and stay quiet . I mean if you are OLA WITH  CHEAP pricing like under 1 lac , i understand but ather with such claims of RandD and all bullshit is just a big scam tbh .",https://reddit.com/r/ATHERENERGY/comments/1o2tius/need_help_choosing_between_ather_iqube_chetak_ola/njej7k2/,2,,,,
reddit,2025-10-10T17:42:59,lxcky04,Even I got my Rizta a week ago i still didn't get the stack version 7 update,https://reddit.com/r/ATHERENERGY/comments/1o370ok/not_getting_update/nit53fc/,1,,,,
reddit,2025-10-14T09:50:10,Arnav1655,Own a rizta true bro indicators turn on but dont sound and show in dashboard it shows after 5-6min too laggy,https://reddit.com/r/ATHERENERGY/comments/1o370ok/not_getting_update/njf78l5/,1,,,,
reddit,2025-10-14T09:52:41,Hare_97,Either force Ather SC to downgrade your software or just live with it,https://reddit.com/r/ATHERENERGY/comments/1o370ok/not_getting_update/njf7hoj/,1,,,,
reddit,2025-10-10T06:14:51,sinistadilly,"What is your primary reason:

1. Upfront cheaper cost - access
2. Will own for many years and want a product that will last - ather
3. High usage and lots of daily riding - ather
4. Want a good performance and enjoyable ride - ather
5. You enjoy having latest tech and experiences - ather
6. Want basic scooter without having to think too much - access
7. Want long term savings - ather (but only if you ride enough to make savings on servicing cost and charging vs fuel)
8. Don’t want to deal with hassle of charging/don’t have point for home charger - access",https://reddit.com/r/ATHERENERGY/comments/1o2rety/confused_between_ather_and_access/niqab1l/,4,,,,
reddit,2025-10-10T05:28:52,Free-Bother-7713,"If daily distance is more than 15km, go for ather else access",https://reddit.com/r/ATHERENERGY/comments/1o2rety/confused_between_ather_and_access/niq5ad1/,2,,,,
reddit,2025-10-10T04:41:01,Big_Organization_978,if your commute rn is quite long then ather else access ez,https://reddit.com/r/ATHERENERGY/comments/1o2rety/confused_between_ather_and_access/nipzmdw/,1,,,,
reddit,2025-10-10T06:59:40,These_Estimate4538,"If you dont go too far then go for access or vlf mobster 135 and alot of new exciting ICE vehicles.

I own a 450x and its been hell of a ride, i love it. Due to ather i have been able to spin around the city and explore new places and even going 20kms for a chai doesnt feel much but again if usage isnt that much then it doesnt make sense to go for an EV.",https://reddit.com/r/ATHERENERGY/comments/1o2rety/confused_between_ather_and_access/niqf0c5/,1,,,,
reddit,2025-10-11T05:46:14,geekykalyan,Ather..will be best option for you,https://reddit.com/r/ATHERENERGY/comments/1o2rety/confused_between_ather_and_access/niwd35j/,1,,,,
reddit,2025-10-11T07:19:21,Hare_97,"Some people are suggesting ather is good for a longer commute but they are completely forgetting how much it hurts the back because of its shape. I used to ride 60 kms daily (30 up, 30 down) for college. It gets really bad. The issues with its service and manufacturing issues are something else.

With access, you will be sure of its working, service and being able get it repaired for cheap and that too anywhere.",https://reddit.com/r/ATHERENERGY/comments/1o2rety/confused_between_ather_and_access/niwmekn/,1,,,,
reddit,2025-10-10T17:12:39,Stark_of_Gryffindor,70k more for Ather how? R u on shrooms? Don't get carried away with navigation and other pro pack stuff. If u r comparing with Access choose the Rizta S 2.9. Its about 1.2L on road,https://reddit.com/r/ATHERENERGY/comments/1o2rety/confused_between_ather_and_access/nisyrle/,0,,,,
reddit,2025-10-11T12:49:55,HotPhilosophy8305,"Hey I wanted to know about the ather 60% buyback insurance, do we have to pay extra 5000 to avail that offer?? As the service centre people told me that to pay that within 3 months of purchase to get that or have been misled",https://reddit.com/r/ATHERENERGY/comments/1o28upr/have_doubts_about_your_ather_insurance_an_open/nixkzfu/,2,,,,
reddit,2025-10-11T13:37:10,iam_man_ish,"You've likely not been misled. What you're being offered isn't insurance but **Ather's own 'Assured Buyback Program.'**

Think of it as a resale value guarantee directly from the company, not a policy for accidents. So yes, it's completely normal for them to charge an extra fee like ₹5000 to join this optional program.

Before paying, I'd suggest you ask them for the official details in writing just to be sure. Hope that helps!",https://reddit.com/r/ATHERENERGY/comments/1o28upr/have_doubts_about_your_ather_insurance_an_open/nixs5z6/,1,,,,
reddit,2025-10-09T14:29:27,Free-Bother-7713,What does ather official support say about this? Like on app or customer care number,https://reddit.com/r/ATHERENERGY/comments/1o22m3d/issues_with_battery_after_20k_kms/nilop0n/,2,,,,
