source,date,username,content,url,engagement,sentiment,category1,category2,category3
reddit,2025-10-06T08:21:11,warewolf213,I Just charged my rizta with a vida charger no issue,https://reddit.com/r/ATHERENERGY/comments/1nyimhp/petition_to_get_ather_vida_to_solve_the_athers/ni19wwz/,1,,,,
reddit,2025-10-05T14:52:00,TomorrowAdvanced2749,"Yeah, one side getting short end of the stick is completely fine, even after 2 years of the chargers being launched.

I agree it will get better with time, but its annoying cause sometimes when Ather owners wanna charge, it is occupied by Vida owners at times, whereas you rarely can do vice-versa.",https://reddit.com/r/ATHERENERGY/comments/1nyimhp/petition_to_get_ather_vida_to_solve_the_athers/nhwexq7/,1,,,,
reddit,2025-10-05T13:06:30,TomorrowAdvanced2749,"
Even if it is like you said, what use is that?

Huh? It's still useless for Ather owners, especially when we have to give up on charging ours cause some Vida owner wants to charge theirs.",https://reddit.com/r/ATHERENERGY/comments/1nyimhp/petition_to_get_ather_vida_to_solve_the_athers/nhvveb6/,2,,,,
reddit,2025-10-05T14:33:49,SadCoyote6993,"You gotta look at the bigger picture than this entitlement that leads to nowhere, a partnership like this could expand into something much greater with many parties involved, even several smaller players would mean more charging infra for all and that is a plus at the end of the day

Let the vida users iron out their kinks and tbf ather chargers are no stranger to the same issues my rizta randomly decides to not lock on certain chargers and it's the most painful thing to find out after reaching a charger with 1% or 0%",https://reddit.com/r/ATHERENERGY/comments/1nyimhp/petition_to_get_ather_vida_to_solve_the_athers/nhwbb7p/,2,,,,
reddit,2025-10-05T14:39:18,TomorrowAdvanced2749,"FYI, Vida has launched chargers in 2023 or so, if they take 2 years to fix this issue, I don't think they are even working on it.

With Ather charger, you atleast have high chances of getting it to work, with Vida you literally have less than 20% chance of it working, its that bad.

I am all for such collaborations in the future, but if one side is benefitting and the other doesn't, that is not a collaboration, especially when you also consider that Ather owners have paid a premium price for the product, so it also becomes a bit more unjustified to let this crap happen.",https://reddit.com/r/ATHERENERGY/comments/1nyimhp/petition_to_get_ather_vida_to_solve_the_athers/nhwcdy5/,1,,,,
reddit,2025-10-05T14:44:00,SadCoyote6993,"Instead of pulling numbers out of your ass, I urge you actually do some research among ather peers
They do infact work just fine with the several chargers I've used around hyderabad 

This could just be a problem with the chargers in your vicinity and you should probably raise some complaints to where they belong instead",https://reddit.com/r/ATHERENERGY/comments/1nyimhp/petition_to_get_ather_vida_to_solve_the_athers/nhwdbt2/,1,,,,
reddit,2025-10-05T14:47:40,SadCoyote6993,"There you have it, now this could be a result of the vida chargers not being maintained well in Pune with the up to date software or whatever but this does not warrant the partnership to be revoked or a petition to be filed

Instead why don't you urge the pune users to mass complaint to ather instead for them to pick it up with vida",https://reddit.com/r/ATHERENERGY/comments/1nyimhp/petition_to_get_ather_vida_to_solve_the_athers/nhwe2fu/,1,,,,
reddit,2025-10-05T14:50:03,TomorrowAdvanced2749,"I did not say that the partnership should actually be revoked, but did say that if they can't maintain their chargers, they should revoke, why should one side get the short end of the stick, mate?

The petition exactly does that, once its filled by over 100 people, we will share it with Ather & Vida. 

Good day to you, you had some good arguments.",https://reddit.com/r/ATHERENERGY/comments/1nyimhp/petition_to_get_ather_vida_to_solve_the_athers/nhwejn3/,1,,,,
reddit,2025-10-05T14:57:17,SadCoyote6993,"Just looked at the change.org page, The companies probably have exactly the same goal in mind lol
Ather has almost 6-7 years of experience in this regard and vida is catching up",https://reddit.com/r/ATHERENERGY/comments/1nyimhp/petition_to_get_ather_vida_to_solve_the_athers/nhwg0kl/,1,,,,
reddit,2025-10-05T06:13:32,Special-Resort3838,"No so Ather has this dealer policy kind of (which i have noticed a lot of dealers follow), that they only remove this factory mode once the vehicle is registered and the RTO number has been generated.

BTW you can reinstall the mode yourself as well (just press both brakes and start button for 15- 20 secs and it will reinstall the software removing the factory mode and setting to normal one..The dealer showroom can also do this one as well.",https://reddit.com/r/ATHERENERGY/comments/1nygcw6/is_this_a_norm_or_a_case_of_bad_after_sales/nhukavd/,17,,,,
reddit,2025-10-05T06:50:20,Devansh_19409,You can use free ather grid charging,https://reddit.com/r/ATHERENERGY/comments/1nygcw6/is_this_a_norm_or_a_case_of_bad_after_sales/nhuo6uw/,7,,,,
reddit,2025-10-05T07:29:04,ameer65827,That means free ather grid charging.,https://reddit.com/r/ATHERENERGY/comments/1nygcw6/is_this_a_norm_or_a_case_of_bad_after_sales/nhus8fm/,4,,,,
reddit,2025-10-05T07:32:12,Sakshamagarwal2702,Don't touch the shit and enjoy your free charging at Ather grid,https://reddit.com/r/ATHERENERGY/comments/1nygcw6/is_this_a_norm_or_a_case_of_bad_after_sales/nhusjuq/,4,,,,
reddit,2025-10-05T14:15:11,AbbreviationsLow5262,"Bro I have the same issue, i haven't got the number plate yet. But the good thing is I can charge for free on public ather grid charges till this mode is active 🤣💀",https://reddit.com/r/ATHERENERGY/comments/1nygcw6/is_this_a_norm_or_a_case_of_bad_after_sales/nhw7ogj/,2,,,,
reddit,2025-10-05T06:52:15,SnooCakes4945,Just tried on the ritza. Didn’t seem to work.,https://reddit.com/r/ATHERENERGY/comments/1nygcw6/is_this_a_norm_or_a_case_of_bad_after_sales/nhuoe7v/,1,,,,
reddit,2025-10-06T02:02:27,Main-Technology7914,"This is happening with me. I also took 450x hr delivery on the 13th of sept, already rode 1200 km but no removal of factory mode or activation on ather grid wallet is done. Rto registration is already done and the number plate is installed and it's been 15 days since that happened. Complained multiple times they always say they are working on this in priority mode but no resolution yet.",https://reddit.com/r/ATHERENERGY/comments/1nygcw6/is_this_a_norm_or_a_case_of_bad_after_sales/ni00377/,1,,,,
reddit,2025-10-05T09:53:03,dogizzgod,"Same issue with me. Purchased Rizta Z 20 days back with pro pack. I have been told that the pro pack is out of stock, so currently waiting for it. When asked abou the factory mode they asked me not to remove the factory mode before the pro pack gets activated as the vehicle needs to be in factory mode to receive the pro pack activation. Didn't make much sense but just using the vehicle in the factory mode as of now to be on the safe side.",https://reddit.com/r/ATHERENERGY/comments/1nygcw6/is_this_a_norm_or_a_case_of_bad_after_sales/nhv6y3n/,3,,,,
reddit,2025-10-05T10:35:14,Free-Bother-7713,"Thats for neighbourhood charging, for ather grid you just have to unplug the charger and charge ur two wheeler, tho ensure you have enough balance",https://reddit.com/r/ATHERENERGY/comments/1nykqr5/adyar_slam_fitness_charging_station/nhvbce8/,5,,,,
reddit,2025-10-05T16:28:08,No_Flight_7684,"My Ather has done 35 k Kms.
Rear Tyres changed at 14k and 28 K Kms. 

But first find the source of air leak. Low thread does not cause air leak. May be. Small puncture or small dent in alloy may cause air leak. 

Considering the warranty, change it at Ather service.",https://reddit.com/r/ATHERENERGY/comments/1nygkck/tire_change/nhwyl9v/,3,,,,
reddit,2025-10-06T14:22:42,AbbreviationsLow5262,"Get the new ntread or something it's called, i just bought the 2025 450x and according to ather just from this tire we get +15km range.",https://reddit.com/r/ATHERENERGY/comments/1nygkck/tire_change/ni2n9pe/,2,,,,
reddit,2025-10-08T19:17:55,These_Estimate4538,"Research about e-thread tyres which come with 2025 ather models, it will give you more range around 15-20kms. But i don't know how good they grip under braking since its low resistance tyres.

I use Reise tyres and they have been pretty good

I will switch to Michelin for the next set in few months",https://reddit.com/r/ATHERENERGY/comments/1nygkck/tire_change/nih1ejz/,2,,,,
reddit,2025-10-05T09:58:31,UserID7056,"I don't know. I usually ride at 40-50km/hour. My friend's dad is also using Ather 450, they had to change at 9K.",https://reddit.com/r/ATHERENERGY/comments/1nygkck/tire_change/nhv7ivh/,1,,,,
reddit,2025-10-07T18:43:03,LemonHappy3130,ather jus has shi tires stock..,https://reddit.com/r/ATHERENERGY/comments/1nygkck/tire_change/niaiyes/,1,,,,
reddit,2025-10-05T14:15:03,MysticsThrone,Have TC version but haven't got the update🙂 they're prioritizing rizta too much at ths POT,https://reddit.com/r/ATHERENERGY/comments/1nygkck/tire_change/nhw7nlx/,1,,,,
reddit,2025-10-05T11:54:19,s_m_rio,"Oh thats bad, Which version of the Ather app are you using currently? I’m on v12 and haven’t run into that issue, app updates and location sync seem to be working fine for me",https://reddit.com/r/ATHERENERGY/comments/1nyb2x1/lock_home_screen_widget_to_show_ather_battery/nhvknig/,1,,,,
reddit,2025-10-04T18:17:30,Sakshamagarwal2702,"You are correct, but in my Smart Plug I noticed that when I don't use key (resembling power cuts) my charger uses only 320-340 watts to charge (while in normal condition it charges at 680-700 watts) and after sometime it drops to 4watts and then again 340 watts and this continues..I noticed that the charger light blink but Ather App doesn't show as it is charging...

Is that with me or common issue?",https://reddit.com/r/ATHERENERGY/comments/1ny13or/direct_charging_without_using_key_ather_rizta_37/nhrbi6t/,1,,,,
reddit,2025-10-07T10:37:58,jaganm,"The biggest issue for early adopters like me is that they had the lining in light grey. In our country with the heat and the dust, I am sure they never tested it even a little bit outside their studio. I just stopped using it for the city rides as I can't keep removing and washing the fabric every few weeks, there are a few that you can't remove and it makes me nauseous even looking at it.

  
There is a reason that every single helmet maker uses black fabric and then there is Ather!",https://reddit.com/r/ATHERENERGY/comments/1nxqdw7/is_halo_worth/ni828cr/,1,,,,
reddit,2025-10-04T05:36:09,anonymous-_-maybe,"I have experienced both and the more reliable one is the eco mode. It has less range but it is precise and the speed and throttle is fixed. So when you want to overtake and you know you can manage it at that limited speed , you have control of the situation. 
The smart eco has more range ( 10 -15 kms ) but its throttle and top speed are variables. They depend on certain conditions which you don't know exactly. Initially you will get a good boost and after a few kms of driving the throttle is slowly reduced to save range. The problem lies in the fact that the throttle is so slow that to get from 20 to 40 kmph speed it takes 15 seconds. Enough to cause trouble. On a good day the smart eco will totally behave like zip mode and I won't even notice the throttle drop anywhere in my 34 km journey and on random days the throttle will nearly get me into an accident . It is unreliable in my opinion. 
Good thing ather added eco mode. Take it with a grain of salt , but it is indeed the more reliable one.",https://reddit.com/r/ATHERENERGY/comments/1nxhfm3/what_does_smart_eco_do/nho8qo2/,5,,,,
reddit,2025-10-04T03:08:23,Own-Mission-278,"Smarteco mode is the mode which the had originally in Ather before stack 7 update.

If you want exact KM that you use to get before update switch to SmartEco.

The Current ‘Eco’ has a drop of 10-20 km.",https://reddit.com/r/ATHERENERGY/comments/1nxhfm3/what_does_smart_eco_do/nhnqlbm/,2,,,,
reddit,2025-10-04T02:36:07,Devansh_19409,Smart eco is a riding mode which was already in rizta before update,https://reddit.com/r/ATHERENERGY/comments/1nxhfm3/what_does_smart_eco_do/nhnm2gx/,1,,,,
reddit,2025-10-04T17:15:35,Over-Werewolf8696,"I purchased my ather 450x Gen3 in Jan 2023
In Aug 2025 it spontaneously showed some serious battery issue like I used to ride for 2kms and suddenly the battery would go from 80% to 20%. Even if the scooter was kept on it would drain every minute and the scooter would full charge again within 2 hours on a slow charger . I transported my scooter to the service center at first he said that it might be because of the software update which I very recently installed and connected the scooter with his laptop for some software update. Later gave me for test drive but the issue was still there, he filled the job card and it took him 3 days to respond that my scooter's battery would get changed because of severe degradation which I have no idea how it happened because it was just 11500kms on it with only 2 services and no other problems at all . It took a good 10-12 days for the service center guy to call me back but they changed it all for free just took some 160rs of some battery foam and it has been a smooth ride for me with Ather since then.",https://reddit.com/r/ATHERENERGY/comments/1nx1puv/i_got_my_battery_replaced_for_free/nhqypew/,1,,,,
reddit,2025-10-03T16:39:39,Cyanide_eXtasy595,Gen 3 so I'm guessing most likely late 2022 at the earliest to Mid 2023 ishh (before they released the ather without the touchscreen display),https://reddit.com/r/ATHERENERGY/comments/1nx1puv/i_got_my_battery_replaced_for_free/nhkmqam/,3,,,,
reddit,2025-10-03T18:17:53,Hare_97,"First, this range is achievable only if you are running non-stop: if on any trip I made a long stop, the usable range becomes a lot lower.

Second is network. Ather uses a lot, I mean a lot of battery just to stay connected to network. It can drain 10% overnight if you live in a very poor network area. It's normally 2-3% otherwise.

Last would be weight on scooter, your driving habits and tyre pressure.

Now coming to Ather fault:
- MRF tyres lose a lot of air pressure due to its structure, get them changed if necessary
- New Atherstack has made several scooters range drop by 10-20%
- Sometimes front brakes keep pressing, an old issue which still creeps in making range lower. You have get those repaired.
- If all these are not the reason, either I forgot it or ather's battery is at fault",https://reddit.com/r/ATHERENERGY/comments/1nx5zdd/help_me_out_ather_community/nhl78eq/,3,,,,
reddit,2025-10-03T14:38:06,mastema004,"Okay.... So, u should mail ather regarding the bad service experience. Also, make sure make sure the service history gets updated, if it doesn't... u won't be able to claim any warranty later on. 

Coming to app based booking.. to me also, when I went for service, the guy told it won't be possible today. However, when I said I have prebooked from the app.. his tone changed and he asked me to wait a bit and later on did my service.

BTW my rare tyre also has an issue n now I'm wondering if its with all Ritza XD",https://reddit.com/r/ATHERENERGY/comments/1nx0mes/is_that_normal_in_all_ather_service_centers/nhjxlld/,5,,,,
reddit,2025-10-04T15:27:16,Devil_700,"Bhai belt tension tool dekha hi nhi fir tumne kabhi

https://www.acroenterprise.net/products/belt-tension-meter/153 

Esa hota hai jo ather vale use krte hai 

Or kuch manual bhi ate hai saste",https://reddit.com/r/ATHERENERGY/comments/1nx99qg/belt_tension_tool/nhqcyh7/,1,,,,
reddit,2025-10-03T08:20:22,Inner-Atmosphere2249,Go to SC they'll fix it i had this issue in my rizta and my 450x but SC fixed it and the problem never came back,https://reddit.com/r/ATHERENERGY/comments/1nwslrs/any_solution_for_this/nhifc3b/,3,,,,
reddit,2025-10-03T07:43:48,AnubhavKiToLagGayi,Rizta ka default feature hai ye 🫶🏻 pata chalna chahie na gaadi aa rahi hai,https://reddit.com/r/ATHERENERGY/comments/1nwslrs/any_solution_for_this/nhibopd/,2,,,,
reddit,2025-10-03T06:55:36,fat_penis69_,Ather 420,https://reddit.com/r/ATHERENERGY/comments/1nwrfmm/ather_450/nhi6qk5/,13,,,,
reddit,2025-10-03T07:58:21,Big_Organization_978,so ather is finally releasing a 450cc scooter after ditching electric,https://reddit.com/r/ATHERENERGY/comments/1nwrfmm/ather_450/nhid4sn/,7,,,,
reddit,2025-10-03T06:57:42,nirav_lol,Ather 690,https://reddit.com/r/ATHERENERGY/comments/1nwrfmm/ather_450/nhi6ypf/,6,,,,
reddit,2025-10-03T10:28:51,StrengthProud6417,Ather 67,https://reddit.com/r/ATHERENERGY/comments/1nwrfmm/ather_450/nhislzw/,2,,,,
reddit,2025-10-03T13:25:56,believeingod333,Ather 47,https://reddit.com/r/ATHERENERGY/comments/1nwrfmm/ather_450/nhjjh36/,1,,,,
reddit,2025-10-03T13:27:41,Evening_Bus746,Ather 550Y MR,https://reddit.com/r/ATHERENERGY/comments/1nwrfmm/ather_450/nhjjsxk/,1,,,,
reddit,2025-10-03T06:56:19,Crranky_27,Ather 069,https://reddit.com/r/ATHERENERGY/comments/1nwrfmm/ather_450/nhi6tfj/,7,,,,
reddit,2025-10-03T09:01:04,ismyaltaccount,Ather 007,https://reddit.com/r/ATHERENERGY/comments/1nwrfmm/ather_450/nhije69/,2,,,,
reddit,2025-10-03T09:40:12,gabrielleraul,Ather 143,https://reddit.com/r/ATHERENERGY/comments/1nwrfmm/ather_450/nhinbms/,4,,,,
reddit,2025-10-04T16:36:33,1PerpetuallyAnxious,Ather 619,https://reddit.com/r/ATHERENERGY/comments/1nwrfmm/ather_450/nhqqpsg/,1,,,,
reddit,2025-10-03T07:58:25,Sakshamagarwal2702,How long since you are using Ather?,https://reddit.com/r/ATHERENERGY/comments/1nwst3z/is_ather_450s_worth_buying/nhid52d/,1,,,,
reddit,2025-10-03T08:05:43,Pitiful-Pen12,I feel it is 3 year or 20000 whichever is earlier. Again I have only ordered ather not delivered yet,https://reddit.com/r/ATHERENERGY/comments/1nwqlsb/belt_warranty_question/nhidvfy/,1,,,,
reddit,2025-10-02T13:11:52,movingphoton,"I bought in the cost of ather into their stocks. I've made my money back for the vehicle. 
Hope it'll be like eicher motors.",https://reddit.com/r/ATHERENERGY/comments/1nvxhiv/3_years_completed_with_my_ather_450x/nhcxs1y/,1,,,,
reddit,2025-10-03T02:11:20,Individual_Edge_3947,"It will work once in a full moon, Ather has really forgot the rizta s varient softwares, its very glitchy, sometimes when you close the scooter it shows weird letters for 3 to 5 second then it close.",https://reddit.com/r/ATHERENERGY/comments/1nvw0kc/turn_by_turn_navigation_not_working_on_my_rizta_s/nhh4la8/,3,,,,
reddit,2025-10-02T06:22:07,sinistadilly,Navigation should not be related to permissions on ather app as the nav is through inbuilt SIM card. Could be at outage with google maps maybe. Raise a ticket and check with ather customer care.,https://reddit.com/r/ATHERENERGY/comments/1nvw0kc/turn_by_turn_navigation_not_working_on_my_rizta_s/nhblih9/,2,,,,
reddit,2025-10-02T12:15:32,Flaky-Photo-2919,Hey.. your rizta's pro pack is already activated right?,https://reddit.com/r/ATHERENERGY/comments/1nvw0kc/turn_by_turn_navigation_not_working_on_my_rizta_s/nhcoczp/,2,,,,
reddit,2025-10-03T17:04:02,Flaky-Photo-2919,"Check ather app, Account -my subscription - ather connect feature must be showing inactive. Maybe after complete activation all features will start working.",https://reddit.com/r/ATHERENERGY/comments/1nvw0kc/turn_by_turn_navigation_not_working_on_my_rizta_s/nhkrzie/,1,,,,
reddit,2025-10-09T15:58:33,Flaky-Photo-2919,I got positive reply from the support team to wait till the new update ather app 12.1.0.. rolling out soon.,https://reddit.com/r/ATHERENERGY/comments/1nvw0kc/turn_by_turn_navigation_not_working_on_my_rizta_s/nim6pfz/,1,,,,
reddit,2025-10-03T04:02:22,Embarrassed-Tree-597,"I bought from ather experience centre, called avatar pack.  The seat cover has a blue that is similar to scooter. Not exact match but close. Body guard is colorless",https://reddit.com/r/ATHERENERGY/comments/1nvwb7x/planning_to_book_ather_450_apex_this_festive/nhhlvlw/,1,,,,
reddit,2025-10-02T13:58:04,Hare_97,"Bro forgot the petrol home delivery startups....

But ather sales team themselves keep suggesting not to use ather grid saying ""It will hurt your battery"". Does getting fuel at the station hurt your scooter? If it does, it's more of a dealer problem not a scooter problem. E20 is good for E20 compatible vehicles. Yamaha Fascino is famous for giving 65kmpl+  due to its hybrid engine (Father owns a Fascino and lots of Honda in past). There's a reason almost more than half of Goans own Fascino. Jupiter also gives 50kmpl+, only honda is lacking at 40kmpl owing recent lack of innovation in favour of reliability.

Chetak, iQube, Ola and Ather, all these big 4 EVs are failing in my region. If you ask them their issues after a year of use, half of them are either unaware that they are experiencing any issues thinking its normal for EVs. The other half has gotten good EVs. But still among these people if you were to point out any common issue you will find that they all have the same experience.

In my area, there are 3 service centres. The 2 major SC gets 40+ scooters per day for repairs and many of them are repeat. Like why would you want to be a repeat SC visitor?",https://reddit.com/r/ATHERENERGY/comments/1nvwb7x/planning_to_book_ather_450_apex_this_festive/nhd6de3/,2,,,,
reddit,2025-10-01T09:57:02,No-man_show,"Op ,congo.
Get a good insurance and buy all the necessary covers with your insurance as add-ons.Get zero dep so all your expenses will be covered if any unfortunate incident occurs.
A cheap one is not necesarily the best one .
Visit ather service centre and ask which insurance has better claim response and payment experience .
Because for the next 5 years or 8 year ,the service centre is going to assist you in every service related issue .",https://reddit.com/r/ATHERENERGY/comments/1nv2ojh/update_finally_made_the_purchase_with_the_sbi/nh5r3pl/,1,,,,
reddit,2025-10-01T10:28:30,Imaginary-Stress4567,"i called new dealer showeroom multiple times but seems like guys are very busy for dushera rush today i saw this in news latter athere beat ola in units sales  [https://auto.economictimes.indiatimes.com/news/two-wheelers/ather-energy-outperforms-ola-in-september-e2w-sales-closes-in-on-bajaj/124228557](https://auto.economictimes.indiatimes.com/news/two-wheelers/ather-energy-outperforms-ola-in-september-e2w-sales-closes-in-on-bajaj/124228557)

  
I dont think dealership will give extra 3 year waranty free for online cosomers like me EV 2 wheeler markketplace is wierd 

Ather is good for costomers with hart in right place but cant say same about its dealearships",https://reddit.com/r/ATHERENERGY/comments/1nv2ojh/update_finally_made_the_purchase_with_the_sbi/nh5uhax/,1,,,,
reddit,2025-10-01T05:19:31,AfterGuava1,"I had the same issue, I bought rizta about a month ago and even get 110km range which was unexpected and after update it was reduced to 85-90km what worked for me is turn on smart eco from settings and it will again display and go 100km. Eco was introduced because smart eco has power lag.",https://reddit.com/r/ATHERENERGY/comments/1nuzifv/rizta_range_reduced_after_software_update/nh4z6qf/,2,,,,
reddit,2025-09-30T14:27:06,Mak19o7,I was thinking to buy ather 450x but couldnot since my flat owner didnot allow the connection thrgouh meter .. and i have no other option to charge it from 3rf floor ? Any suggestions,https://reddit.com/r/ATHERENERGY/comments/1nu6ej6/ama_20000kms_done_in_a_year/nh0gpm7/,1,,,,
reddit,2025-09-30T10:44:35,Apprehensive_Ask_945,Why not rizta,https://reddit.com/r/ATHERENERGY/comments/1nu6ej6/ama_20000kms_done_in_a_year/ngzgohc/,1,,,,
reddit,2025-09-30T14:33:09,These_Estimate4538,I'll 5'11 too my weight is 73kgs. I felt the scooter is small but it is doable for me. I felt the sit is perfect for sporty riding style. Rizta felt too big for me.,https://reddit.com/r/ATHERENERGY/comments/1nu6ej6/ama_20000kms_done_in_a_year/nh0hwsc/,1,,,,
reddit,2025-09-30T11:14:03,TensionNo3451,Looks.. personally i liked 450x more than rizta.. it’s a personal opinion though,https://reddit.com/r/ATHERENERGY/comments/1nu6ej6/ama_20000kms_done_in_a_year/ngzkcjo/,2,,,,
reddit,2025-10-01T07:39:04,These_Estimate4538,"For family! Go for rizta.

60kms/3.7kw when im ripping the scooter completely (quick acceleration , hard braking , warp )
If i dont use brakes that much , dont do random pulls and drive it in 60kmph-70kmph i get around 110-120kms too. 

Service was good earlier but now its getting tough as sales are increasing. But i made friends here at service centre 😂 and if i face issues i report it on app and then go to the service centre so they solve it quickly",https://reddit.com/r/ATHERENERGY/comments/1nu6ej6/ama_20000kms_done_in_a_year/nh5drgs/,2,,,,
reddit,2025-09-30T14:58:02,AnubhavKiToLagGayi,we need Ather helmet for it or update will be rolled out?,https://reddit.com/r/ATHERENERGY/comments/1nu6ej6/ama_20000kms_done_in_a_year/nh0mzfv/,2,,,,
reddit,2025-10-01T03:02:14,CuteSocks7583,"Playing music and connecting headphones is done on your phone; the Ather can be used to control it.

Pothole detection is yet to come, I think",https://reddit.com/r/ATHERENERGY/comments/1nujehb/ather_450x_new_features/nh4h3cr/,2,,,,
reddit,2025-10-01T07:08:02,RvidD1020,I hate autohold anyway. Not reliable. Ather should have included simple brake lock,https://reddit.com/r/ATHERENERGY/comments/1nu6m03/what_does_this_symbol_mean_it_appears_in_higher/nh5ar1r/,1,,,,
reddit,2025-09-30T16:47:28,sunil259,https://shop.atherenergy.com/products/rizta-side-step,https://reddit.com/r/ATHERENERGY/comments/1nubf6a/do_anyone_have_the_link_of_only_side_guard_of/nh19epl/,1,,,,
