source,date,username,content,url,engagement,sentiment,category1,category2,category3
reddit,2025-10-09T13:35:52,sayami007,"Tori haru le, Nepal ma manche haru lai chalauna aundaina bhanera nadeko rey..   
Riss wothera..

Mero Ather Rizta ho, test drive garda Magic Twist thyo.. chaluana majja aayeko thyo..   
Kine pachi chai, Magic Twist Nepal ma manche haru lai chalauna garo hune bhayeko le hatako rey.. 

Na ta Magic twist cha, na Regen huncha 😡😡",https://reddit.com/r/ATHERENERGY/comments/1o22fg3/magic_twist_in_nepal_not_available/nilenpj/,3,,,,
reddit,2025-10-09T13:49:18,confusedchickenwings,Same in Sri Lanka. The only two countries Ather exports its bikes are Sri Lanka and Nepal. And both these countries seem to not have magic twist.,https://reddit.com/r/ATHERENERGY/comments/1o22fg3/magic_twist_in_nepal_not_available/nilh1xs/,3,,,,
reddit,2025-10-12T12:32:43,Hare_97,There must be some regulatory issue or something. It can be enabled with software update in future so you don't actually have to worry much. Though I hate Ather PR from the bottom of my heart now,https://reddit.com/r/ATHERENERGY/comments/1o22fg3/magic_twist_in_nepal_not_available/nj3d3cl/,1,,,,
reddit,2025-10-11T01:51:20,PuzzleheadedCellist6,"Nope, unless ather introduce it in the dashboard, as of now SC is the only option, that too is available after a certain kms (10k if I'm not wrong)",https://reddit.com/r/ATHERENERGY/comments/1o258dx/how_to_check_battery_health/nivi458/,1,,,,
reddit,2025-10-09T06:48:55,These_Estimate4538,Get ather body guards ... It will protect the main key areas atleast.,https://reddit.com/r/ATHERENERGY/comments/1o1yyn9/my_ather_450x_got_scatched_today_in_left_corner/nik2aey/,0,,,,
reddit,2025-10-09T08:30:43,Asrafeel,"Ather has launched PPF i think, they showcased in ACD this year",https://reddit.com/r/ATHERENERGY/comments/1o1yyn9/my_ather_450x_got_scatched_today_in_left_corner/nikc1qm/,1,,,,
reddit,2025-10-08T15:07:04,YourRedditMate,"Apart from Ather’s Eight Seventy, which insurance actually provides EV Batttery and Motor protection?",https://reddit.com/r/ATHERENERGY/comments/1o1coei/getting_the_right_insurance_for_your_ather_a/nifm0bj/,3,,,,
reddit,2025-10-08T16:07:46,iam_man_ish,"Here’s the inside scoop that many don't know, based on what happens during actual claims. You're right to be skeptical about specific ""EV covers"" for two-wheelers. The main issue is salvage value.

Think about it, just like you said: if the battery on an Ather is severely damaged, what's the real value left in the rest of the scooter? Almost nothing.

Because of this, if there's major damage to the battery or motor, the repair cost can easily be more than 75% of the scooter's value. When that happens, the insurance company will declare it a ""total loss"".

This is exactly where the Return to Invoice (RTI) add-on becomes the real hero.

If your scooter is declared a total loss (which is very likely after major battery damage), the RTI add-on ensures you get back the full original on-road price you paid. Not just the current market value (IDV).

So, a much safer strategy for a new scooter isn't hunting for a specific battery cover, but making sure you have a solid Return to Invoice (RTI) add-on. It's the cleanest and most effective way to protect your investment.",https://reddit.com/r/ATHERENERGY/comments/1o1coei/getting_the_right_insurance_for_your_ather_a/nifyh7j/,4,,,,
reddit,2025-10-08T17:14:07,Devil_700,Bhai agr apke pas ather hai uski RC mai model name check Krna shayad policy mai alag ho es mere sath hua tb pta chla jab mene apna OD insurance renew krvaya to model name mai Rizta Z 3.7kwh pro pack likha tha pr RC mai model name ese nhi likha hota usme to Bs Rizta Z MX08 us wqt usne bola ki koi nhi bill mai jo hoga vhi chl jaegi pr jab mene bill dekha usme bhi Rizta Z MX08 hi likha hai or fir uske baad mene customer care se baat kri to unhone btaya ki same hona chaiye isliye ab changes ke liye request raise kr rakhi hai or is tarah se koi bhi company ke insurance mai ather Rizta ke model name shi nhi Dale hai,https://reddit.com/r/ATHERENERGY/comments/1o1coei/getting_the_right_insurance_for_your_ather_a/nigc4jh/,1,,,,
reddit,2025-10-09T15:54:41,iam_man_ish,"Thats a major point of confusion for many EV owners after these Battery warranty from the Brand.

The simplest way to think about it is: **Insurance is for ACCIDENTS. Warranty is for PERFORMANCE & DEFECTS.**

Let me break it down based on your question:

1. **Your Insurance (Return to Invoice and Battery Protect):** This covers your scooter from sudden, unforeseen events. The Battery Protect add-on would help if your battery gets damaged in a **crash, a flood, or a fire**. If the damage is so severe that the scooter is a ""total loss,"" the RTI add-on would get you the full invoice value back. It will **not** cover the battery if its health just drops over time from normal usage.
2. **Ather's Warranty (the 'eight seventy' plan):** This is the manufacturer's promise about the product's quality and performance. If your battery health drops below 70% from normal charging and use within the warranty period, **this is a warranty issue**. Ather is responsible for replacing it, not the insurance company.

So, to answer your question directly: No, insurance will absolutely not cover the battery replacement if its health drops below 70%. You would still need the Ather warranty for that kind of performance-related issue.

You need both, as they protect you from completely different kinds of problems. It's like having health insurance to cover a broken leg (an accident) vs. the manufacturer's warranty on your phone if its screen stops working on its own (a defect).

Hope that makes it crystal clear!",https://reddit.com/r/ATHERENERGY/comments/1o1coei/getting_the_right_insurance_for_your_ather_a/nim5x7f/,1,,,,
reddit,2025-10-09T15:37:23,iam_man_ish,"Bhai aaj hi ek ather insurance issue kia for a reddit friend from this sub; it was Rizta S MX 06 in invoice, but in the policy will not come because the insurance company doesn't register like that model. It will be Rizta S 2.9 kW. Insurance for the motor's KW is important, not the battery's KW. 

The KW of the vehicle matters rather than the name. I have issued multiple insurances like that and settled the claims also without any hassle. So don't worry. Just check the KW.",https://reddit.com/r/ATHERENERGY/comments/1o1coei/getting_the_right_insurance_for_your_ather_a/nim2dry/,1,,,,
reddit,2025-10-08T10:00:22,Forgotten_Millenial,"Ather is pretty ethical in my experience , congratulations on the scooter, if they had that colour when i was buying i would have picked it !",https://reddit.com/r/ATHERENERGY/comments/1o13rq1/ather_turned_complaint_into_moment_of_trust/nieadql/,10,,,,
reddit,2025-10-08T18:23:59,rockntalk,"With 2 Ather vehicles at home, they still not have managed to replace my helmet (which was broken out of the box) since a month. 

I did get an update that it will be closed soon but I have never seen Ather go to this extent like you have mentioned in the post.",https://reddit.com/r/ATHERENERGY/comments/1o13rq1/ather_turned_complaint_into_moment_of_trust/nigqnct/,3,,,,
reddit,2025-10-08T10:28:16,Main-Technology7914,In my experience some people damage the overall brand reputation. Otherwise IMO Ather as a brand has high values.,https://reddit.com/r/ATHERENERGY/comments/1o13rq1/ather_turned_complaint_into_moment_of_trust/niede6i/,3,,,,
reddit,2025-10-08T11:00:58,Main-Technology7914,"I got my registration plate in 15 days but they do provide a rto acknowledgement in 5-6 days for traffic purposes. My vehicle was delivered on the 13th of sept. On the second day of delivery we received a stack 7 update and after that got a kind of pro pack activation but with very limited information on the mobile app. And with factory mode watermark. Also ather grid wallet was also not activated till yesterday. Only after getting angry, they do the needful things. But later when the sales person called me that the seniors were blaming him for providing misinformation to me, I felt bad.. and today after everything sorted out the dealer and a representative of ather from nagpur visited me.",https://reddit.com/r/ATHERENERGY/comments/1o13rq1/ather_turned_complaint_into_moment_of_trust/niehb1e/,1,,,,
reddit,2025-10-08T17:25:01,Big_Organization_978,"complain to ather cc from app itself, they maybe slow but they'll make sure you get proper service",https://reddit.com/r/ATHERENERGY/comments/1o1clo5/odometer_got_reset_to_0km/nigeg91/,1,,,,
reddit,2025-10-08T17:45:44,Hare_97,"Then make sure to document all the receipts and documents. The handle issue is sure to come back (at least that's my experience and some other ather users). When that time comes, you should raise a ticket.

Honestly, that handling issue caused me an accident and this is not a thing which can be excused.",https://reddit.com/r/ATHERENERGY/comments/1o1clo5/odometer_got_reset_to_0km/nigiu0n/,1,,,,
reddit,2025-10-08T17:47:18,rishiiiya,"Bruh, ig it got mine coz i used alot my rizta in rain",https://reddit.com/r/ATHERENERGY/comments/1o1clo5/odometer_got_reset_to_0km/nigj5u1/,1,,,,
reddit,2025-10-09T14:00:37,chetan714,"Buy the seat cover, mat and body guard, especially the body guard, my Rizta hit wall 2 times when backing up. It worth purchasing.",https://reddit.com/r/ATHERENERGY/comments/1o13lk6/which_accessories_to_buy_for_rizta/nilj4u1/,1,,,,
reddit,2025-10-08T12:47:01,Arnav1655,True my body protector is rusting within an year ather sc says it has no warranty,https://reddit.com/r/ATHERENERGY/comments/1o13lk6/which_accessories_to_buy_for_rizta/niewnss/,1,,,,
reddit,2025-10-08T20:13:36,Mocking_Jay_1993,"I am just a frustrated Ola electric victim, who doesn't know what to do? Where to go for justice? So crying out on reddit. 
Ather is Ola's rival, posted in its group to get some support and advice.",https://reddit.com/r/ATHERENERGY/comments/1o1bron/lets_get_all_ola_electric_showrooms_closed/nihd0k6/,2,,,,
reddit,2025-10-09T07:31:03,believeingod333,We here having chill with ATHER XDDDD,https://reddit.com/r/ATHERENERGY/comments/1o1bron/lets_get_all_ola_electric_showrooms_closed/nik6fiv/,2,,,,
reddit,2025-10-08T13:14:54,Long_Introduction_94,"Hi, I bought the Ather Apex 2025 on September 17th and received the delivery on September 22nd. I was initially told I could start using all the features immediately since the pro pack was included, but removing the factory mode would take some time after the number was generated. I also purchased the TPMS along with the scooter and scheduled an installation appointment for September 24th. When I arrived, I was told that the TPMS could only be installed after the factory mode was removed. I was asked to wait for about 30-60 minutes and to check with the salesperson, which I appreciated. Luckily, it was resolved within 40 minutes. I was then advised to pick up the vehicle in the evening. While the process was a bit slow initially, I appreciate the staff’s efforts to resolve everything once I followed up. I also understand that delays in activating the pro pack and billing for the eighty70 battery extension can happen due to high demand and busy schedules. Overall, I appreciate the attempt to address my concerns, and I hope future processes become smoother for everyone.",https://reddit.com/r/ATHERENERGY/comments/1o19k6o/ather_pro_pack_activation_delay_a_new_phenomenon/nif1i4l/,2,,,,
reddit,2025-10-09T03:50:33,dogizzgod,Posted it long back did not work.. By consumer helpline if u mean with ather customer service. Did that also 12 days back no help from their end as well.,https://reddit.com/r/ATHERENERGY/comments/1o19k6o/ather_pro_pack_activation_delay_a_new_phenomenon/niji5f3/,1,,,,
reddit,2025-10-08T06:11:49,AnubhavKiToLagGayi,"Are you new to Ather? This is how Ather works, 1-2 months to fix something basic is common here, keep tagging them on Twitter everyday if you want quick resolution.",https://reddit.com/r/ATHERENERGY/comments/1o11k9a/stack_pro_not_activated/nidnymx/,1,,,,
reddit,2025-10-08T13:04:42,Devansh_19409,Damn ather app theme changes with color !!,https://reddit.com/r/ATHERENERGY/comments/1o0rvgp/unusual_activity_warning/niezplu/,1,,,,
reddit,2025-10-08T10:44:52,ismyaltaccount,"Seems like a software bug. I have also noticed some bugs on my Ather. Pretty bad tbh that they're not doing proper QA before pushing out ""features"".",https://reddit.com/r/ATHERENERGY/comments/1o0rvgp/unusual_activity_warning/niefbax/,2,,,,
reddit,2025-10-07T09:39:39,These_Estimate4538,"Go for Rizta

But if your usage is less then consider a petrol scooter too.",https://reddit.com/r/ATHERENERGY/comments/1o09z1d/which_ev_i_must_buy/ni7w2ad/,6,,,,
reddit,2025-10-07T09:40:38,Big_Organization_978,rizta,https://reddit.com/r/ATHERENERGY/comments/1o09z1d/which_ev_i_must_buy/ni7w5tc/,3,,,,
reddit,2025-10-07T11:22:28,No-man_show,"Avoid Rizta for now or even if you are buying do a through check by driving before taking delivery .
This is coming from a person who own 2 rizta 2.9 kwh .
I have shared my experience in this sub yesterday .
You mentioned last point -Its for family , thus suggested .",https://reddit.com/r/ATHERENERGY/comments/1o09z1d/which_ev_i_must_buy/ni87r7q/,2,,,,
reddit,2025-10-07T10:08:33,Flaky-Photo-2919,My commute is very less and I am losing 4-5% daily in standby mode. I own Rizta S 2.9.,https://reddit.com/r/ATHERENERGY/comments/1o09z1d/which_ev_i_must_buy/ni7z0fq/,1,,,,
reddit,2025-10-07T14:47:01,Arnav1655,I own a rizta Z 2.9 7k completed no problem faced only one service centre visit of 5k service…. Booked 450x too…,https://reddit.com/r/ATHERENERGY/comments/1o09z1d/which_ev_i_must_buy/ni96ilx/,1,,,,
reddit,2025-10-07T12:30:07,AnubhavKiToLagGayi,"Same, avoid Ather for now.",https://reddit.com/r/ATHERENERGY/comments/1o09z1d/which_ev_i_must_buy/ni8hlgh/,1,,,,
reddit,2025-10-12T08:36:50,Flaky-Photo-2919,"Bro I am still happy with it. It's obvious to overnight drain . It has gps, ather connect (Jio Sim network). I love to track my vehicle from anywhere, anytime mode. Rizta is love.",https://reddit.com/r/ATHERENERGY/comments/1o09z1d/which_ev_i_must_buy/nj2o2w4/,1,,,,
reddit,2025-10-07T14:42:49,Arnav1655,Mene to ather sc me call krke renew kraya…,https://reddit.com/r/ATHERENERGY/comments/1o0aidr/insurance_mistakes_in_ather_rizta/ni95nww/,2,,,,
reddit,2025-10-14T12:52:57,Historical-Junket-13,I bought new ather rizta Z 2.9kwh with pro pack and my invoice says mx06 but in my insurance policy it says mx08 and when I asked the agent he said there is no option to mx06 in their system. What should I do?,https://reddit.com/r/ATHERENERGY/comments/1o0aidr/insurance_mistakes_in_ather_rizta/njfuw8a/,1,,,,
reddit,2025-10-07T06:37:25,cloudkats,Should not happen or maybe ather downgrade the quality of products,https://reddit.com/r/ATHERENERGY/comments/1o0673z/accessories_provided_are_not_official/ni7ee8s/,1,,,,
reddit,2025-10-07T06:49:15,AfterGuava1,I know kasliwal ather indore does that. They provide after market accessories I have seen this at dealership.,https://reddit.com/r/ATHERENERGY/comments/1o0673z/accessories_provided_are_not_official/ni7floz/,1,,,,
reddit,2025-10-07T08:48:33,Divakar_Singrol,"Post it in each and every social media platforms with proofs and invoice, tag ather, tarun mehta, Swapnil Jain also mail them, as I did if you are aware about my case for third party accessories and then I got the original accessories.",https://reddit.com/r/ATHERENERGY/comments/1o0673z/accessories_provided_are_not_official/ni7r6au/,1,,,,
reddit,2025-10-07T21:10:56,Prophet9192,Sorry to hear this OP. Do follow up with the steps suggested by others. Original Ather accessories are also available on their website in case you need to buy.,https://reddit.com/r/ATHERENERGY/comments/1o0673z/accessories_provided_are_not_official/nibcjyy/,1,,,,
reddit,2025-10-07T06:59:59,SinVampire,ather stack 7 sucks,https://reddit.com/r/ATHERENERGY/comments/1o04mx1/dashboard_not_working/ni7gpcf/,2,,,,
reddit,2025-10-07T05:29:52,believeingod333,"Dang, which model is this? Is it Rizta? Give some reviews, bro.",https://reddit.com/r/ATHERENERGY/comments/1nzp144/is_this_normal_in_30_days/ni777rw/,2,,,,
reddit,2025-10-07T06:55:15,SinVampire,"Rizta z (3.7kwh) there are alr soo many reviews out there anyways i love riding the scooter its fun to ride and the siting posture is also comfortable not like activa i used to get really bad pain i feel the suspension is stiff but when i had my cousins as pillions they told the suspension was good and the seat and the under seat storage is massive 
im not evn touching my bike its been there lying around the corner",https://reddit.com/r/ATHERENERGY/comments/1nzp144/is_this_normal_in_30_days/ni7g7yo/,3,,,,
reddit,2025-10-07T03:41:17,deepu_24m,"In factory mode, you get free access to ather fast chargers at no additional cost.

Enjoy while it lasts.",https://reddit.com/r/ATHERENERGY/comments/1nzst8s/factory_mode/ni6tywt/,3,,,,
reddit,2025-10-06T15:54:36,professionalslayer,"Rizta Z 159 IDC, Top Spec owner here.

Look, The Rizta is an amazing EV, hands down. The first time i experienced Zip mode, it blew me away. Even today when the signal turns green, it zips ahead in an instant.

Talking about Service, it obviously depends on your location, however in my experience it has been so far amazing. The Staff is friendly and very welcoming.

Now, coming to the point of 8 Years Battery warranty. You need to understand that the stock price gets you 3 years. You have to upgrade to the pro pack to get it upto 5 years and then you unlock the 8 year tier. You cannot go to the 8 year mark without getting the pro pack. So cost is going to be a consideration. Especially if you compare to traditional ICE scooters, the 8 year tier is going to set you back by a good amount.

I personally own 3 Athers, 2 of which have the 8 year warranty. It is a no brainer if you value comfort and top notch features that wont let you down.

When i brought my rizta sometime back, i had a fixed idea. I needed Magic Twist and Skid control. I almost never need Navigation and fancy display, but the Z is the only option if you need Magic Twist and Skid Control, so i got the Z.

If you feel that you can do without maps and the ""Z"" feature set, then go for the S with 159 IDC.

And dont drive the scooter with only cost savings in mind. Many people emphasize so much on range and cost mathematics that they simply dont enjoy the upgrade that their ride got. Yes, it is cheaper. But more importantly, it is a lot better quality wise.  
I haven't driven the other brands long enough for me to comment",https://reddit.com/r/ATHERENERGY/comments/1nzm7t7/looking_for_some_good_reviews_to_convince_my_mom/ni3668j/,3,,,,
reddit,2025-10-06T15:55:12,Free-Bother-7713,"I'll keep it short
1. Ather service has downgraded, but the job is done somehow
2. Yes it won't breakdown at 60 km/h but the quality of parts have worsen over the time so idk much about the current status
3. To check the date of battery you have to check it during pdi below the foot area
4. tvs icube has hub motor don't go for it 
5.  Rizta should easily last 10-12 years with around 60ish soH (my assumption and it depends upon ur usage)
6. dont go for any petrol two wheelers as of now due to E20 scandal",https://reddit.com/r/ATHERENERGY/comments/1nzm7t7/looking_for_some_good_reviews_to_convince_my_mom/ni36ar7/,1,,,,
reddit,2025-10-06T17:13:00,Hare_97,"Brother, E20 affects mostly older (non E20 vehicles). 

As for the points he has missed:
- Service people might be friendly, but their technical knowledge can be very poor depending on the centre and area.
- It caused a limp mode issue in the first week of ownership to me, never again (lots of people have this experience).
- In the rain, it is highly reliable but would suggest you to immediately swap those MRF tyres, their grip is completely absurd. CEAT is my family choice and from recent posts, Michelin is great. If you stick to MRF, the road grip confidence drops a ton with pillion or on less grippy roads.
- Ather battery and motor are great but everything except that has gone through a lot of quality downgrades. The plastic can be easily damaged and if you ride in bumpy roads...oh well.
- The biggest natural enemy is rats..they got my wires twice.
- Other is coneset issue, even after repair it doesn't go away (one 20k Km user reported it has been a recurring for him as well)
- The main point is charging. If you have even a single inconvenience for charging system setup, please avoid the EV sector. Many apartment or flat users get EV and then are always fighting for bills and permissions. Leaving your system in the open has been a pain as well.

Edit: If you expose it to too much rain, headlight fogging and handle stiffness can also happen. Your rear section will always be full of mud. But at least it will never die in the middle of rain.",https://reddit.com/r/ATHERENERGY/comments/1nzm7t7/looking_for_some_good_reviews_to_convince_my_mom/ni3m70i/,1,,,,
reddit,2025-10-06T18:18:12,believeingod333,"What's wrong with the TVS iQube, I mean with its hub motor, and how is it different from Ather's motor?",https://reddit.com/r/ATHERENERGY/comments/1nzm7t7/looking_for_some_good_reviews_to_convince_my_mom/ni3zjwg/,1,,,,
reddit,2025-10-07T04:33:53,Free-Bother-7713,"Hub motor is very inconvenient, when you want to change the rear tyre you will have to go to the service centre then have the motor removed and then change the tyre and then reinstall the tyre
Apart from that if by mistake you go through a pothole at high speed there's a high chance it will damage ur motor and I believe it will not be covered under warranty
Ather has mid-drive motor which is smooth and extremely reliable",https://reddit.com/r/ATHERENERGY/comments/1nzm7t7/looking_for_some_good_reviews_to_convince_my_mom/ni70pvm/,1,,,,
reddit,2025-10-12T05:25:41,daggerdik_,Im buying rizta top variant with accessories at a final price of 1.87L does this seem too much expensive??,https://reddit.com/r/ATHERENERGY/comments/1nzmpty/ather_rizta_and_pathetic_experience_i_need_your/nj2530n/,1,,,,
reddit,2025-10-06T15:59:09,Arnav1655,Yess i too seen that but sadly i alr own rizta so I dont want two same vehicle I need speed,https://reddit.com/r/ATHERENERGY/comments/1nzibhk/diwali_offers/ni374it/,2,,,,
reddit,2025-10-06T13:04:04,Arnav1655,Like last year ather gived 5k cash discount n 8k card discount offline and online it is just 5k card discount…,https://reddit.com/r/ATHERENERGY/comments/1nzibhk/diwali_offers/ni28wdj/,1,,,,
reddit,2025-10-06T15:58:29,Arnav1655,My city ather sc dont sell on amazon those idiots only sell on fk and when sell comes they make the product unavailable in fk too…. Does any offers can come before diwali!? I alr own rizta z and looking new vehicle without pro pack,https://reddit.com/r/ATHERENERGY/comments/1nzibhk/diwali_offers/ni36zha/,1,,,,
reddit,2025-10-06T16:00:58,Healthy_Mango2255,It's applicable for all Ather models,https://reddit.com/r/ATHERENERGY/comments/1nzibhk/diwali_offers/ni37i1a/,1,,,,
reddit,2025-10-06T13:06:19,TomorrowAdvanced2749,"It is 9k on HDFC cards, also, I am not really sure if they even have card discount, cause the dealerships usually fret on letting you use the card as there's fees for them to accept one.

Also, the discount on product should reflect online too, not just for dealership purchases.

  
The card discount at Ather dealership was on EMI, lol, what use is that? The interest is pretty decent itself.",https://reddit.com/r/ATHERENERGY/comments/1nzibhk/diwali_offers/ni29ap4/,1,,,,
reddit,2025-10-06T13:18:55,TomorrowAdvanced2749,"FK, it is 5.5K for 450, it seems. I was looking at Rizta in morning and it was 9k something.",https://reddit.com/r/ATHERENERGY/comments/1nzibhk/diwali_offers/ni2bit3/,1,,,,
reddit,2025-10-06T12:58:09,Arnav1655,Seems no my fan turns off as soon as i turn off the vehicle. I own a rizta z,https://reddit.com/r/ATHERENERGY/comments/1nzfu69/is_it_okay_if_the_dashboard_heat_sink_fan_keeps/ni27vfp/,2,,,,
reddit,2025-10-06T11:39:12,pudine-ki-chutney,the dash has a fan? rizta or 450x,https://reddit.com/r/ATHERENERGY/comments/1nzfu69/is_it_okay_if_the_dashboard_heat_sink_fan_keeps/ni1vl2l/,1,,,,
reddit,2025-10-06T12:57:32,Arnav1655,Rizta too,https://reddit.com/r/ATHERENERGY/comments/1nzfu69/is_it_okay_if_the_dashboard_heat_sink_fan_keeps/ni27rld/,1,,,,
reddit,2025-10-06T15:00:11,Ion-980,Have you linked your account to alexa through the ather app settings?,https://reddit.com/r/ATHERENERGY/comments/1nzk13v/how_do_i_pair_my_ather_with_alexa/ni2uwnd/,1,,,,
reddit,2025-10-06T15:06:41,reply-doge,"When I click link, it takes me to the playstore page on ather. Even tho ather app is installed",https://reddit.com/r/ATHERENERGY/comments/1nzk13v/how_do_i_pair_my_ather_with_alexa/ni2w8sk/,1,,,,
reddit,2025-10-05T09:43:03,Arnav1655,Separate vida from ather we are happy with our less chargers the vida guys always using ather chargers,https://reddit.com/r/ATHERENERGY/comments/1nyimhp/petition_to_get_ather_vida_to_solve_the_athers/nhv5wmm/,5,,,,
reddit,2025-10-05T14:46:40,sinistadilly,EV charging is still nascent industry in India. It will have some issues. There is a reason no other 2w companies are willing to share charging ports besides Ather coz it’s very complicated. I’m sure they’ll figure it out as both companies tech capabilities also improve.,https://reddit.com/r/ATHERENERGY/comments/1nyimhp/petition_to_get_ather_vida_to_solve_the_athers/nhwdv03/,2,,,,
reddit,2025-10-05T13:03:49,SadCoyote6993,"I don't think ather users are getting the short end of the stick, a vida charger close to my college doesn't work even with vida's 
It's probably vida's not being mature enough as of yet",https://reddit.com/r/ATHERENERGY/comments/1nyimhp/petition_to_get_ather_vida_to_solve_the_athers/nhvuydp/,1,,,,
